id,year,majortopic,subtopic,description,filter_eu,var2,var3,var5,day,month,var15,var17,var18,var98_questionname,calendar_year,var14
169287,2014,15,1505,"Mener ministeren, at det er rimeligt, at der findes borgere, der endnu ikke har fået en endelig afklaring fra Stormrådet eller deres forsikringsselskab på deres sag, efter stormfloden Bodil ramte Danmark tilbage i december 2013, og derfor stadig er fastlåste i en meget uholdbar situation, som både udfordrer deres evne til at klare hverdagens almindelige udfordringer, deres arbejde og ikke mindst deres mentale og fysiske helbred?",0,89,890110,12,17,10,,1505,,,2014,10/17/2014
169289,2014,13,1300,Hvad er status på regeringens sociale 2020-plan?,0,89,890112,42,17,10,,1300,,,2014,10/17/2014
169291,2014,9,900,"Er ministeren enig i, at regeringen siden sin tiltræden har gjort det betydeligt mere attraktivt at søge til Danmark som asylansøger?",0,89,890114,6,17,10,,900,,,2014,10/17/2014
169292,2014,9,900,"Hvad er ministerens forventning til virkningen af regeringens bebudede justering i adgang til familiesammenføring for visse flygtninge, når justeringen antagelig alene vil have betydning for en tredjedel af de syriske asylansøgere?",0,89,890115,6,17,10,,900,,,2014,10/17/2014
169290,2014,9,900,"Er ministeren enig i, at regeringen har lempet udlændingepolitikken 31 gange siden sin tiltræden i 2011?",0,89,890113,6,17,10,,900,,,2014,10/17/2014
169288,2014,3,333,"Hvordan agter ministeren at sikre, at de berørte borgere fra stormfloden i december 2013, der endnu er fastlåst i en meget uholdbar situation, får den nødvendige psykosociale støtte fra kommuner og regioner, de har krav på, så de ikke får langvarige men, men igen kan blive gode, ressourcestærke borgere?",0,89,890111,42,17,10,,333,,,2014,10/17/2014
169338,2014,15,1520,"Er ministeren enig i, at forslaget om at afgiftsharmonisere på taxiområdet, jf. regeringens udkast til »Vækstplan 2014 – Danmark helt ud af krisen«, oprindelig hvilede på en forudsætning om, at taxiloven skulle revideres først, med henblik på at skabe lige konkurrence og vækstmuligheder, og kan ministeren på den baggrund være enig i, at vi bør vente med en lov, der ændrer på taxiernes eksisterende beskatnings- og frikørselsordninger, til der er skabt fælles fodslag om rammer med lige og fair konkurrence og vækstmuligheder i taxierhvervet?",0,89,890161,18,24,10,,1520,,,2014,10/24/2014
169337,2014,10,1099,"Hvordan vurderer ministeren, at en ny afgift på 180 pct. på brugte taxier, og dermed en mindre jævnlig udskiftning af udslidte taxier til nye og mere sikre versioner, vil berøre trafiksikkerheden?",0,89,890160,18,24,10,,1099,,,2014,10/24/2014
169369,2014,6,602,"Hvad vil ministeren gøre for at sikre, at alle folkeskolelærere i løbet af deres uddannelse får lært at styre en klasse, sådan at larm og uro for fremtiden bliver et mindre problem i den danske folkeskole, således som det også er intentionen med folkeskolereformen fra 2013?",0,89,890192,28,30,10,,602,,,2014,10/30/2014
169376,2014,10,1003,"Hvilke initiativer har ministeren iværksat på baggrund af den undersøgelse, som ministeren har udarbejdet, jf. ministerens svar på spørgsmål nr. S 106 i Folketingssalen den 22. oktober 2014, med henblik på at løse det akutte problem med, at politiet i Københavns Lufthavn ikke længere har adgang til det såkaldte PIU-register, indeholdende bl.a. passagerlister og kreditkortinformationer, til eksempelvis kontrol af illegale personer?",0,89,890199,6,31,10,,1003,,,2014,10/31/2014
169388,2014,9,900,"Er det ministerens opfattelse, at der er klarhed over, hvor mange asylansøgere der vil blive omfattet af de af regeringen foreslåede justeringer?",0,89,890211,6,31,10,,900,,,2014,10/31/2014
169391,2014,2,207,"Hvorfor mener ministeren ikke, at vi opnår bedre resultater fra Trossamfundsudvalget, som skal arbejde for en sammenhængende lovregulering for andre trossamfund end folkekirken, ved at sikre faste pladser i udvalget til repræsentanter fra disse trossamfund?",0,89,890214,42,31,10,,207,,,2014,10/31/2014
169377,2014,20,2000,"Er det ministerens vurdering, at det store fald i antallet af offentligt ansatte i kommunerne under den nuværende regering har betydet en markant ringere service til borgerne?",0,89,890200,3,31,10,,2000,,,2014,10/31/2014
169378,2014,9,900,"Vil ministeren redegøre for, om hun er enig med Aarhusborgmester Jacob Bundsgaard, når han i Washington Post ifølge jp.dk den 20. oktober 2014 om hjemvendte islamister bl.a. er citeret for følgende: »Vi kan ikke vedtage love, som ændrer den måde, de tænker og føler. Men vi kan vise dem, at vi er seriøse, når det gælder integration og dialog«?",0,89,890201,6,31,10,,900,,,2014,10/31/2014
169384,2014,9,900,Vil ministeren definere en udlændingepolitisk lempelse?,0,89,890207,6,31,10,,900,,,2014,10/31/2014
169398,2014,20,2009,"Finder ministeren det retssikkerhedsmæssigt rimeligt, at SKAT afviser at give skatteyderne medhold, fordi det »vil være en hvepserede« på grund af arbejds- og sagsmængden?",0,89,890221,23,31,10,,2009,,,2014,10/31/2014
169385,2014,9,900,"Deler ministeren statsministerens opfattelse af, at regeringen har gjort det, den kan, inden for konventionerne i forbindelse med regeringens foreslåede justeringer af længden af opholdstilladelse til visse flygtninge og disses adgang til familiesammenføring? ",0,89,890208,6,31,10,,900,,,2014,10/31/2014
169387,2014,9,900,"Er ministeren enig med sin forgænger i, at der sker asylshopping i Europa?",0,89,890210,6,31,10,,900,,,2014,10/31/2014
169380,2014,17,1707,"Synes ministeren, at DR optræder økonomisk ansvarligt, når lukningen af UnderholdningsOrkesteret vil koste over 50 mio. kr., sådan som MetroXpress har afdækket den 27. oktober 2014?",0,89,890203,21,31,10,,1707,,,2014,10/31/2014
169379,2014,20,2000,"Er det ministerens vurdering, at det store fald i antallet af offentligt ansatte i kommunerne under denne regering flugter med regeringens politik og de løfter, der blev afgivet af socialdemokraterne inden valget i 2011?",0,89,890202,3,31,10,,2000,,,2014,10/31/2014
169389,2014,12,1201,"Hvad agter ministeren at foretage sig for at sikre, at den store tilstrømning af asylansøgere ikke går ud over politiets øvrige arbejdsopgaver?",0,89,890212,6,31,10,,1201,,,2014,10/31/2014
169397,2014,20,2009,"Mener ministeren, at SKAT kan afvise at følge en afgørelse fra Motorankenævnet, fordi SKAT ikke mener at være forpligtet til at lægge Motorankenævnets retsopfattelse til grund, som beskrevet i Politiken den 20. oktober 2014?",0,89,890220,23,31,10,,2009,,,2014,10/31/2014
169390,2014,14,1405,"Mener ministeren virkelig, at regeringen prioriterer målrettede initiativer til at skabe større vækst og bosætning på småøerne samt Ærø, Læsø og Samsø tilstrækkeligt?",0,89,890213,10,31,10,,1405,,,2014,10/31/2014
169422,2014,20,2001,"I forlængelse af spørgetiden den 5. november 2014, hvor ministeren forklarede, at grunden til, at Socialdemokraterne ikke har kunnet indfri løftet om ekstra 12 mia. kr. til kommunerne, skyldes VK-regeringens førte politik, hvorfor fremgår det så af regeringsgrundlaget, at: »udgangspunktet for regeringen er VK-regeringens økonomiske politik i bredeste forstand«?",0,89,890245,3,5,11,,2001,,,2014,11/5/2014
169419,2014,6,602,"Vil ministeren i anledning af Operation Dagsværk den 5. november 2014 oplyse, hvad ministeren vil gøre for at sikre, at undervisningstiden i gymnasiet bliver brugt på undervisning og ikke på politiske projekter?",0,89,890242,15,5,11,,602,,,2014,11/5/2014
169423,2014,20,2001,"Hvad er årsagen til, at regeringen ikke har indfriet løftet, der blev givet i »Fair Løsning«, om ekstra 12 mia. kr. i økonomiske råderum til kommunerne?",0,89,890246,3,5,11,,2001,,,2014,11/5/2014
169428,2014,21,2104,"Kan ministeren oplyse, om ministeren er enig med Guldborgsund Havne i, at Orehoved Havn ikke skal stå ringe, når den nye storstrømsbro står færdig?",0,89,890251,18,6,11,,2104,,,2014,11/6/2014
169429,2014,10,1007,"Er ministeren enig i, at vi skal udvikle Det Blå Danmark?",0,89,890252,18,6,11,,1007,,,2014,11/6/2014
169430,2014,20,2009,"Er det i overensstemmelse med ministerens opfattelse af god retssikkerhed, at man i SKAT kan påberåbe sig tavshedspligt om en ændring af ligningsvejledningen i en konkret sag, når man ved, at ændringen også har betydning for andre skatteydere?",0,89,890253,23,6,11,,2009,,,2014,11/6/2014
169447,2014,3,331,"Hvorfor mener regeringen ikke, at der er behov for en kræftplan IV, som foreslået af Venstre?
",0,89,890270,14,7,11,,337,,,2014,11/7/2014
169439,2014,3,334,"Hvordan vil ministeren sikre, at regionerne bruger alle hospicepladser, der er til rådighed, så de ikke står tomme på grund af sparehensyn?",0,89,890262,14,7,11,,334,,,2014,11/7/2014
169433,2014,5,599,"Mener ministeren, ligesom spørgeren, at det er vanvittigt, at en arbejdsgiver skal udarbejde en udførlig arbejdspladsbrugsanvisning for, hvordan afkalkningsmiddel til en kaffemaskine bruges rigtigt, hvis det er en del af medarbejderens arbejdsopgaver at stå for kaffebrygningen, når der findes kaffemaskiner og afkalkningsmiddel i enhver danskers hjem?",0,89,890256,4,7,11,,599,,,2014,11/7/2014
169435,2014,12,1210,"Mener ministeren, at det er rimeligt, at politiet ikke efterforsker indbrud til under 100.000 kr.?",0,89,890258,6,7,11,,1210,,,2014,11/7/2014
169436,2014,9,900,"Mener ministeren, at der er brug for at gennemføre stramninger over for de flygtninge, hvoraf mange er bekvemmelighedsflygtninge, der opnår asyl ved at påstå, at de er individuelt forfulgte?",0,89,890259,6,7,11,,900,,,2014,11/7/2014
169434,2014,1,107,"I en undersøgelse fra Dansk Iværksætterforening angiver 40 pct. af de adspurgte, at deres største daglige udfordring er spørgsmålet skat og moms, mener ministeren, at det er acceptabelt, at en så stor andel af nystartede virksomheder oplever, at SKAT står i vejen for vækst og jobskabelse?",0,89,890257,23,7,11,,107,,,2014,11/7/2014
169438,2014,13,1303,"Hvorledes vil ministeren sikre, at der fortsat ikke er nogen borgere, der fratages hjemmehjælp, fordi de ikke ønsker at gennemføre et rehabiliteringsforløb?",0,89,890261,42,7,11,,1303,,,2014,11/7/2014
169446,2014,9,900,"Kan ministeren give noget svar på, hvordan regeringen vil håndtere asylsituationen i lyset af dommen fra den europæiske menneskerettighedsdomstol?",1,89,890269,6,7,11,,900,,,2014,11/7/2014
169443,2014,12,1200,"Hvad er ministerens holdning til, at det tager 433 dage i gennemsnit fra en kriminel handling anmeldes indtil gerningsmanden begynder afsoningen af sin straf?",0,89,890266,6,7,11,,1200,,,2014,11/7/2014
169452,2014,7,709,"Når ministeren under et samråd afholdt den 6. november 2014 om linjeføringen af København-Ringstedbanen udtalte, at det ikke har været muligt at foretage VVM-undersøgelser vedrørende dyrelivet i området for et østligt anlæg af niveaufri overskæring, fordi tiden efter den 19. maj ligger uden for ynglesæsonen, fastholder ministeren så denne udtalelse, og hvad har ændret sig i forhold til de undersøgelser, der blev udført ved den vestlige løsning for niveaufri overskæring af flagermus og markfirben henholdsvis den 7. juni 2013 og den 2. august 2013?",0,89,890275,18,7,11,,709,,,2014,11/7/2014
169453,2014,1,104,"Anser ministeren det som et demokratisk problem, at pengeskabelsen i samfundet er uden for Nationalbankens kontrol, og kan ministeren redegøre for de økonomiske konsekvenser ved, at pengeskabelsesprivilegiet er placeret hos et stadigt faldende antal private pengeinstitutter, jf. udtalelsen fra Nationalbankens seneste kvartalsoversigt i artiklen »Penge, Kredit og bankvæsen« om, at penge i den moderne økonomi skabes via de private banker- og realkreditinstitutioners udlån: »Når en bank yder et lån til en husholdning eller en virksomhed, vil provenuet fra lånet i første omgang blive krediteret låntagerens bankkonto. Et udlån vil derfor ofte i første omgang blive modsvaret af et tilsvarende indlån og dermed en stigning i pengemængden«?",0,89,890276,12,7,11,,104,,,2014,11/7/2014
169440,2014,3,331,"Hvordan vil ministeren sikre, at kræftpatienter får ernæringstilskud nok efter eller under en kræftbehandling, når de ikke kan tåle de fuldgyldige produkter, samt ikke har råd til dem, der tidligere har været tilskud til?",0,89,890263,14,7,11,,337,,,2014,11/7/2014
169454,2014,10,1005,"Kan ministeren garantere, at indholdet af en VVM-redegørelse vedrørende niveaufri overskæring øst eller vest for Ringsted alene bestemmes af Banedanmark, som er myndighed på projektet?",0,89,890277,18,7,11,,1005,,,2014,11/7/2014
169432,2014,5,501,"Hvad er ministerens holdning til det vanvittige forhold, at en ung under 15 år, der endnu ikke er gået ud af 9. klasse, ikke må arbejde med ekspedition i en større forretning men godt i en lille butik, således at det er forretningens størrelse, der er afgørende, men ikke hvor hårdt, hvor meget og hvor belastende arbejdet er for den unge?",0,89,890255,4,7,11,,501,,,2014,11/7/2014
169445,2014,9,900,"Hvad er ministerens holdning til, at der i øjeblikket om måneden er over 300 dispensationsøgninger med hensyn til statsborgerskaber, hvor der hovedsageligt anmodes om dispensation fra sprogkravene, og at næsten alle dispensationer bliver givet?",0,89,890268,6,7,11,,900,,,2014,11/7/2014
169444,2014,17,1707,"Hvorfor valgte ministeren i Politiken at opfordre DR til at fremlægge alle dokumenter vedrørende Det Europæiske Melodi Grand Prix, når hun samtidig ikke ønsker at forholde sig til nedlæggelsen af Radiounderholdningsorkestret og til stadighed forsvarer DR’s ret til at nedlægge det?",0,89,890267,21,7,11,,1707,,,2014,11/7/2014
169448,2014,3,300,"Er ministeren enig i, at kræftpakkerne, som VK-regeringen indførte sammen med regionerne, i vid udstrækning har øget ligheden i sundhed for danskerne – ikke mindst for dem med kort eller ingen uddannelse?",0,89,890271,14,7,11,,300,,,2014,11/7/2014
169437,2014,13,1303,"Vil ministeren redegøre for, om det er i overensstemmelse med regeringens nyere lovgivningsinitiativer om rehabilitering og hjemmehjælp, at Københavns Kommunes sundheds- og omsorgsborgmester i medierne melder ud, at såfremt en borger ikke ønsker at deltage i et rehabiliteringsforløb, kan denne fratages sin hjemmehjælp?",0,89,890260,42,7,11,,1303,,,2014,11/7/2014
169472,2014,19,1901,"Da Hamas er den anden rigeste terrororganisation i verden med en årlig »omsætning«, der runder 2 mia. amerikanske dollar, kan ministeren så garantere, at Hamas ikke direkte eller indirekte kan disponerer over de danske donationer i Gaza og på Vestbredden?",0,89,890295,12,13,11,,1901,,,2014,11/13/2014
169471,2014,20,2009,"Mener ministeren, at det er i overensstemmelse med god retssikkerhed, at skattemyndighederne kan vente et par år med at offentliggøre en ny praksis i skattesager, når man er vidende om, at borgere i samme periode pålægges skattepligt, bøder og straf efter den gamle praksis?",0,89,890294,23,13,11,,2009,,,2014,11/13/2014
169473,2014,19,1901,"I forbindelse med donorkonferencen i Kairo i oktober 2014 blev der givet et samlet tilsagn om 31,8 mia. kr. til genopbygningen af Gaza, mener ministeren, at denne gigantiske bevilling er en rimelig prioritering set i forhold til de økonomiske rammer, der eksempelvis er til rådighed for andre og større udviklingspolitiske tiltag, eksempelvis under UNHCR, FN's flygtningeorganisation?",0,89,890296,12,13,11,,1901,,,2014,11/13/2014
169470,2014,1,107,"Mener ministeren, at det er i overensstemmelse med god retssikkerhed, at det i et tilfælde, hvor en person, der boede i udlandet, men havde en bolig i Danmark og arbejdede under sine ophold i Danmark, blev afgjort at 3 dages arbejde ikke var nok til at udløse skattepligt, og i en anden sag blev afgjort, at 7 arbejdsdage udløste skattepligt samt fængsel i 1 år og 9 måneder og en klækkelig bøde?",0,89,890293,23,13,11,,107,,,2014,11/13/2014
169476,2014,6,604,Har regeringen opgivet muligheden at skabe flere praktikpladser?,0,89,890299,15,14,11,,604,,,2014,11/14/2014
169479,2014,6,604,"Mener ministeren, at det er rimeligt, at eleverne på erhvervsskolerne fravælger praktik i et praktikpladscenter, fordi de ikke vil nøjes med en elevydelse svarende til SU?",0,89,890302,15,14,11,,604,,,2014,11/14/2014
169487,2014,9,900,"Hvad er ministerens holdning til artiklen i Den Korte Avis »Indvandrerbørn ned til syv år deltager i chikane mod naboer til ghettoen – myndighederne gør ingenting« den 13. november 2014, og hvad vil ministeren gøre for at genoprette ro og orden i området, så almindelige mennesker tør færdes i området, redningskøretøjer kan køre uden politieskorte, og byggearbejdere kan passe deres arbejde?",0,89,890310,6,14,11,,900,,,2014,11/14/2014
169474,2014,6,604,"Giver antallet af elever, der ikke fortsætte deres uddannelse, fordi de ikke kan finde en praktikplads, ministeren anledning til bekymring?",0,89,890297,15,14,11,,604,,,2014,11/14/2014
169488,2014,9,900,"Mener ministeren, at genindførelsen af flygtninges ret til fuld folkepension er finansieret i overensstemmelse med regeringens forsigtighedsprincip?",0,89,890311,3,14,11,,900,,,2014,11/14/2014
169477,2014,12,1208,"Hvilke tiltag vil ministeren tage for at hjælpe forældre til børn med autisme, der i dag af mange kommuner presses og stresses med sanktioner og pålæg, hvis forældrene ikke kan få deres børn i det skoletilbud, de er blevet placeret i?",0,89,890300,42,14,11,,1208,,,2014,11/14/2014
169484,2014,9,900,"Når der i øjeblikket gives ca. 300 dispensationer om måneden i forhold til sprogkrav til opnåelse af statsborgerskab, vil ministeren så redegøre for, hvilken indflydelse det har på integrationen, at personer ikke kan det danske sprog i tilstrækkelig grad? ",0,89,890307,42,14,11,,900,,,2014,11/14/2014
169482,2014,6,602,Hvorfor har ministeren ikke udlignet de ubegrundede taxameterforskelle mellem handelsgymnasierne (HHX) og de almene gymnasier (STX) i forbindelse med finansloven 2015?,0,89,890305,15,14,11,,602,,,2014,11/14/2014
169486,2014,19,1921,"Hvad er ministerens holdning til den seneste udvikling i sagen om Lars Hedegaard, herunder at det danske generalkonsulat i Istanbul den 29. august 2014 modtog besked om, at den formodede attentatmand var blevet udleveret til sikkerhedsmyndighederne med henblik på at blive udleveret til sit land, som tilsyneladende skulle være Syrien?",0,89,890309,6,14,11,,1920,,,2014,11/14/2014
169489,2014,9,900,"Er ministeren enig med handels- og udviklingsministeren i, at der er en forventning om, at de af regeringen foreslåede justeringer vil føre til, at Danmark modtager færre asylansøgere i 2015?",0,89,890312,6,14,11,,900,,,2014,11/14/2014
169480,2014,6,604,"Mener ministeren, at der er nok praktikpladser i virksomhederne, og hvilke initiativer agter ministeren at tage for at skaffe yderligere pladser?",0,89,890303,15,14,11,,604,,,2014,11/14/2014
169478,2014,6,604,Er ministeren tilfreds med regeringens indsats for at sikre praktikpladser til de unge?,0,89,890301,15,14,11,,604,,,2014,11/14/2014
169475,2014,5,500,"Er det ministerens vurdering, at finanslovsaftalen for 2015 giver et for regeringen tilfredsstillende bidrag til at øge arbejdsudbuddet og dermed sikre en mere holdbar økonomi, og er det herunder ministerens vurdering, at aftalen vil øge incitamentet for ledige til at tage et arbejde?",0,89,890298,13,14,11,,500,,,2014,11/14/2014
169483,2014,9,900,"Vil ministeren redegøre for, hvorfor flygtninge, der kommer til Danmark, med regeringens nye forslag kan få fuld dansk folkepension, og er det ikke diskrimination af bl.a. udlandsdanskere, som ikke har den samme mulighed?",0,89,890306,42,14,11,,900,,,2014,11/14/2014
169481,2014,6,602,"Vil ministeren tage initiativer, der kan sikre, at alle grene af forskningen om klasseledelse kommer til de lærerstuderendes kendskab, – og der ikke er bestemte grene der tabuiseres på uddannelsen, sådan som artiklen »Hvornår holdt autoritet op med at være et fyord« fra Information den 7. november 2014 desværre viser, er tilfældet i dag – sådan at fremtidens folkeskolelærere i højere grad vil være rustet til at holde ro og orden i en klasse og dermed sikre, at børnene får et større fagligt udbytte end det er tilfældet i dag?",0,89,890304,28,14,11,,602,,,2014,11/14/2014
169500,2014,19,1910,"Hvad er Udenrigsministerens holdning til, at EU-parlamentarikerne modtager ca. 30.000 kr. månedligt i såkaldte »blyantspenge«, som der ikke skal redegøres for, og hvad vil ministeren gøre for at ændre den form for pamperpraksis?",1,89,890323,2,20,11,,1910,,,2014,11/20/2014
169512,2014,1,105,"Når regeringen med egne ord går lige til kanten af det tilladelige med finanspolitikken, hvad er så regeringens prioriteringer for at spare penge på det offentlige budget, hvis det viser sig, at forudsætningerne for finanslovsaftalen for 2015 ikke holder?",0,89,890335,3,20,11,,105,,,2014,11/20/2014
169499,2014,19,1910,"Er det ifølge Udenrigsministeren rimeligt, at EU-parlamentarikere modtager ca. 100.000 kr. om måneden og dermed tjener mere end landets statsminister?",1,89,890322,2,20,11,,1910,,,2014,11/20/2014
169509,2014,1,105,"Hvad vil der efter ministerens vurdering mangle i finansieringsgrundlag for finanslovsaftalen for 2015, hvis olieprisen forbliver på det nuværende niveau, som er ca. 78 dollar pr. tønde, og væksten i økonomien samtidig bliver på et niveau som vurderet af vismændene i deres seneste rapport?",0,89,890332,3,20,11,,105,,,2014,11/20/2014
169511,2014,1,105,"Hvad får ministeren til at tro, at olieprisen skal stige med over 25 pct. til næste år, hvilket er en væsentlig forudsætning, der skal indfris, hvis regeringens finanslovsaftale skal hænge økonomisk sammen?",0,89,890334,3,20,11,,105,,,2014,11/20/2014
169510,2014,1,105,"Hvad baserer ministeren forudsætningerne for finanslovaftalen for 2015 på, der bl.a. hviler på en oliepris, som ligger betydeligt over det nuværende niveau, og et vækstskøn for dansk økonomi, som også ligger betydeligt over, hvad de fleste anerkendte økonomer vurderer som realistisk?",0,89,890333,3,20,11,,105,,,2014,11/20/2014
169515,2014,10,1005,"Mener ministeren, at det var fornuftigt at benytte landstrafikmodellen som basis for regeringens Togfonden DK?",0,89,890338,18,21,11,,1005,,,2014,11/21/2014
169518,2014,5,502,"Mener ministeren, at der er initiativer i aftalen om finansloven, der øger tilskyndelsen til at arbejde, for de 333.000, der i dag har en svag tilskyndelse til at arbejde, jf. ministerens egen redegørelse »Fordeling og Incitamenter 2013«?",0,89,890341,13,21,11,,502,,,2014,11/21/2014
169517,2014,9,900,Hvilke initiativer påtænker regeringen at sætte i værk i forhold til udenlandske hjemløse med ulovligt ophold i Danmark?,0,89,890340,42,21,11,,900,,,2014,11/21/2014
169520,2014,5,500,"Mener ministeren, at det er vigtigt at skabe flere private arbejdspladser i Danmark for at sikre flere ledige et arbejde?",0,89,890343,4,21,11,,500,,,2014,11/21/2014
169522,2014,5,502,"Hvilke reformer mener ministeren, der mangler for, at de mange ledige kontanthjælpsmodtagere kan komme i arbejde jf. ministerens udtalelse til Politiko den 20. november 2014?",0,89,890345,13,21,11,,502,,,2014,11/21/2014
169523,2014,5,502,"Mener ministeren som ansvarlig for beskæftigelsessystemet, at det efter indgåelse af aftalen om finansloven er blevet lettere for ledige at komme i arbejde?",0,89,890346,4,21,11,,502,,,2014,11/21/2014
169514,2014,10,1005,"Mener ministeren, at det er forsvarligt, at regeringen vil bruge 28,5 mia. kr. på Togfonden DK, når det allerede før vedtagelsen af loven var velkendt, at der alene til og med 2020 vil mangle 3,7 mia. kr., hvis olieprisen ender med at følge den aktuelle forventning i markedet?",0,89,890337,18,21,11,,1005,,,2014,11/21/2014
169525,2014,19,1921,"Vil udenrigsministeren påtale over for to danske virksomheder, at de ifølge en international NGO bryder international lov i Vestsahara og redegøre for den danske politik på området?",0,89,890348,2,21,11,,1911,,,2014,11/21/2014
169519,2014,13,1302,"Er ministeren tilfreds med, at antallet af kontanthjælpsmodtagere er steget med 27.000 personer under denne regering, og mener ministeren, at den netop indgåede finanslovsaftale trækker i den rigtige retning i forhold til at få færre danskere på kontanthjælp?",0,89,890342,4,21,11,,1302,,,2014,11/21/2014
169516,2014,17,1707,"Hvad er ministerens holdning til, at en række mediesagkyndige vurderer, at armslængdeprincippet er overholdt, når folketingsmedlemmer kræver, at DR's ensembler fortsat er skrevet ind i public service-kontrakten, som det også er tilfældet i den nuværende kontrakt?",0,89,890339,21,21,11,,1707,,,2014,11/21/2014
169521,2014,13,1302,"Er ministeren enig med økonomi- og indenrigsminister Morten Østergaard, der til Radio 24Syv den 21. november har udtalt, at der er behov for yderligere reformer på kontanthjælpsområdet?",0,89,890344,4,21,11,,1302,,,2014,11/21/2014
169528,2014,19,1900,"Vil udenrigsministeren, jf. svaret på URU, alm. del, spørgsmål nr. 29 fra indeværende samling klargøre, om den danske ambassade i Israel også hjælper danske virksomheder, således at disse kan komme i kontakt med virksomheder, der er i bosættelser, som regeringen opfatter som illegale og i strid med international lov, eller er det kun i det af Marokko besatte Vestsahara, at dette ikke er et problem for ambassadøren og direktøren i Udenrigsministeriet?",0,89,890351,2,21,11,,1900,,,2014,11/21/2014
