id,year,majortopic,subtopic,description,filter_eu,var2,var3,var5,day,month,var15,var17,var18,var98_questionname,calendar_year,var14
184911,2015,15,1525,"Hvordan forholder ministeren sig til, at Forbrugerrådet Tænk Kemi afviser ministerens kritik af, at Forbrugerrådets kommunikationsform kan føre til unødig bekymring hos forbrugerne, med henvisning til at lovgivningen på området ikke er god nok, jf. artikel i Altinget den 2. februar 2016?",0,91,910737,9,26,2,,1525,,,2016,2/26/2016
184905,2015,8,800,,0,91,910731,3,26,2,,800,,,2016,2/26/2016
184906,2015,14,1405,"Anerkender ministeren, at det er et forholdsmæssigt stort beløb, nemlig 72 mio. kr., af skatteborgernes penge, som regeringen vil bruge på udflytning af blot 12 arbejdspladser på Dansk Jagt- og Skovbrugsmuseum, og at pengene kunne være anvendt til at skabe nye arbejdspladser i Norddjurs?",0,91,910732,21,26,2,,1405,,,2016,2/26/2016
184924,2015,21,2104,"Deler ministeren Kristian Pihl Lorentzens holdning om, at det er på høje tid at indkalde til forhandlinger om havnepakke III?",0,91,910750,18,26,2,,2104,,,2016,2/26/2016
184925,2015,10,1000,,0,91,910751,7,26,2,,1000,,,2016,2/26/2016
184910,2015,9,900,,0,91,910736,3,26,2,,900,,,2016,2/26/2016
184908,2015,9,900,"Kan ministeren bekræfte, at der ifølge de kommunale udgiftslofter skal spares 7 mia. kr. i kommunerne i 2019 i forhold til i år, og i forlængelse heraf redegøre for, om det samtidig hermed er muligt for kommunerne at forbedre den borgernære velfærd, når de også skal modtage titusindvis af flygtninge de kommende år?",0,91,910734,3,26,2,,900,,,2016,2/26/2016
184916,2015,20,2009,"Vil ministeren forklare, hvorledes ministeren vil reagere på den meget alvorlige kritik, som Statsrevisorerne har udtrykt i deres beretning den 24. februar 2016 vedrørende SKATs forvaltning af og Skatteministeriets tilsyn med refusion af udbytteskat?",0,91,910742,23,26,2,,2009,,,2016,2/26/2016
184921,2015,10,1001,"Opfatter ministeren, på linje med en række ø-borgmestre, regeringens 95 mio. kr. til nedsættelse af færgetaksterne, som et første skridt på vejen mod det fulde landevejsprincip?",0,91,910747,7,26,2,,1001,,,2016,2/26/2016
184917,2015,20,2009,"Vil ministeren redegøre for sin holdning til, at statsrevisorerne i deres beretning den 24. februar 2016 vedrørende SKATs forvaltning af og Skatteministeriets tilsyn med refusion af udbytteskat udtaler, at »Statsrevisorerne må sammenfattende konstatere, at risikostyringen i SKAT og Skatteministeriet har været helt utilstrækkelig«?",0,91,910743,23,26,2,,2009,,,2016,2/26/2016
184909,2015,6,604,"Vil ministeren uddybe, hvorfor ministeren mener, at det er rimeligt, at elever på STU ikke har adgang til Ungdomskortet, jf. ministerens svar på UFU, alm. del, spørgsmål 84?",0,91,910735,28,26,2,,604,,,2016,2/26/2016
184919,2015,20,2002,"Vil ministeren redegøre for, om ministeren mener, at det er realistisk, at kommunerne for at undgå massive milliardnedskæringer i velfærden samlet set kan levere effektiviseringer svarende til størrelsen på omprioriteringsbidraget i 2017?",0,91,910745,3,26,2,,2002,,,2016,2/26/2016
184922,2015,21,2104,"Hvornår indkalder ministeren partierne til drøftelse af støtte til danske havne, som ministeren sagde den 19. november 2015 i et åbent samråd i Udvalget for Landdistrikter og Øer?",0,91,910748,18,26,2,,2104,,,2016,2/26/2016
184914,2015,10,1000,"Hvad mener ministeren, der skal gøres for at begrænse den stigende trængsel, som DI har beregnet koster Danmark 15 mia. kr. årligt, og som kan stige med yderligere 10 mia. kr. de kommende år, hvilket vil koste Danmark vækst og beskæftigelse?",0,91,910740,18,26,2,,1000,,,2016,2/26/2016
184964,2015,9,900,"Hvad mener ministeren om, at shariaråd i Danmark giver råd, der strider mod dansk retskultur?",0,91,910790,11,9,3,,900,,,2016,3/9/2016
184965,2015,9,900,,0,91,910791,11,9,3,,900,,,2016,3/9/2016
184970,2015,23,2300,"Hvad er ministerens kommentarer til, at Kolding Kommune har ændret deres tolkning af lovgivningen, således at Kolding Teater ikke længere lånes ud til velgørende formål for bl.a. hospitalsklovne, når flere andre kommuner tolker lovgivningen anderledes og gerne låner lokaler ud til velgørende formål?",0,91,910796,21,10,3,,2300,,,2016,3/10/2016
184968,2015,9,900,"Hvad er ministerens holdning til realismen i ministerens egne udtalelser om, at: »Grimhøjmoskéen skal lukkes«, hvordan har ministeren tænkt sig at gennemføre det, og mener ministeren ikke, at når en minister udtaler sig, så sker det på regeringens vegne, det forpligter, og det må stå til troende?",0,91,910794,32,10,3,,900,,,2016,3/10/2016
184967,2015,9,900,"Hvad er ministerens holdning til realismen i ministerens egen udtalelse om, at »Jeg har også allermest lyst til bare at få jævnet Grimhøjmoskéen med jorden«, sådan som ministeren udtalte ifølge flere medier i dagene 29. februar og 1. marts 2016, og har ministeren forslag til, hvordan lyst omsættes til konkret handling?",0,91,910793,32,10,3,,900,,,2016,3/10/2016
184969,2015,9,900,,0,91,910795,32,10,3,,900,,,2016,3/10/2016
184974,2015,6,601,,0,91,910800,28,11,3,,601,,,2016,3/11/2016
184987,2015,7,711,"Hvor stort et omfang mener ministeren en grøn tillægspakke til fødevare- og landbrugspakken skal have, og hvor mange tons kvælstof skal samles op, før det er tilstrækkeligt for regeringen?",0,91,910813,9,11,3,,407,,,2016,3/11/2016
184979,2015,9,900,"Hvilke initiativer vil ministeren tage på baggrund af de oplysninger, der er fremkommet i TV 2's dokumentarprogrammer »Moskeerne bag sløret« om ekstremisme, undertrykkelse af kvinder, bigami, socialt bedrageri og svindel med offentlige midler?",0,91,910805,32,11,3,,900,,,2016,3/11/2016
184978,2015,9,900,"Ministeren har udtalt, at hun mest har lyst til at få »jævnet Grimhøjmoskéen med jorden« eller lukket, og hvordan tænker ministeren, at det skal ske?",0,91,910804,32,11,3,,900,,,2016,3/11/2016
184983,2015,5,502,,0,91,910809,28,11,3,,502,,,2016,3/11/2016
184985,2015,7,705,,0,91,910811,9,11,3,,705,,,2016,3/11/2016
184991,2015,7,700,"Mener ministeren, at der er behov for en grøn tillægspakke, der kan samle op på den miljøregning, som fødevare- og landbrugspakken efterlader i 2016, 2017 og 2018, jf. forskernes tilkendegivelse på høringen i Miljø- og Fødevareudvalget den 23. februar 2016?",0,91,910817,9,11,3,,700,,,2016,3/11/2016
184986,2015,13,1304,"Finder ministeren, at det er i orden, at en kvinde med handicap, der har været 25 år på kontanthjælp, har haft 13 arbejdsprøvninger, er spastiker med omfattende kognitive problemer på grund af sin sygdom og der er enlig forsørger, mister over 2.000 kr. netto pr. måned i rådighedsbeløb som følge af Dansk Folkeparti og regeringens besparelser på kontanthjælpen?",0,91,910812,4,11,3,,1304,,,2016,3/11/2016
184982,2015,13,1302,"Kan ministeren give en garanti for, at indførelsen af kontanthjælpsloftet ikke fører til yderligere udsættelser af boligen?",0,91,910808,4,11,3,,1302,,,2016,3/11/2016
184990,2015,4,498,,0,91,910816,9,11,3,,498,,,2016,3/11/2016
184973,2015,12,1227,"Mener ministeren, at det er rimeligt, at Nordjyllands Politi skal bidrage med flest betjente som følge af det øgede terrorberedskab, særligt set i lyset af et stigende antal indbrud i Nordjylland?",0,91,910799,6,11,3,,1227,,,2016,3/11/2016
184989,2015,12,1210,"Vil ministeren indføre regler om eftergivelse af sagsomkostninger, jf. anbefalingerne i betænkning 1547 fra 2014 om sagsomkostninger i straffesager?",0,91,910815,6,11,3,,1210,,,2016,3/11/2016
184984,2015,9,900,,0,91,910810,32,11,3,,900,,,2016,3/11/2016
185014,2015,9,900,"Agter regeringen at gennemføre yderligere stramninger, eksempelvis i form af en styrket grænsekontrol med det formål at begrænse tilstrømningen til Danmark?",0,91,910840,32,17,3,,900,,,2016,3/17/2016
185016,2015,6,601,,0,91,910842,28,17,3,,601,,,2016,3/17/2016
185015,2015,6,601,,0,91,910841,28,17,3,,601,,,2016,3/17/2016
185019,2015,9,900,"Hvad mener ministeren om det rimelige i, at man kan krydse grænsen fra Tyskland til Danmark og der ansøge om asyl som forfulgt, altså anser ministeren Tyskland for at være et usikkert land at opholde sig i?",0,91,910845,32,18,3,,900,,,2016,3/18/2016
185020,2015,9,900,"Hvad er ministerens holdning til, at migranter krydser grænsen til Danmark fra Tyskland uden at have ladet sig registrere i flere sikre vestlige lande, men i stedet søger asyl i Danmark som forfulgte?",0,91,910846,32,18,3,,900,,,2016,3/18/2016
185018,2015,13,1304,"Ville det ikke være hensigtsmæssigt, hvis det blev en varig ordning, at de socialøkonomiske virksomheder, der har til formål at beskæftige førtidspensionister m.fl., generelt blev undtaget fra rimelighedskravet – eventuelt efter en konkret vurdering af, om de lever op til nævnte formål?",0,91,910844,4,18,3,,1304,,,2016,3/18/2016
185021,2015,20,2011,"Er det efter ministerens opfattelse god regeringsførelse, at ministeren dags dato endnu ikke har svaret på spørgsmål nr. 70 og 72, BEU, alm. del, 2014-15 (2. samling) stillet den 31. august 2015 og den 28. september 2015, og hvad er forklaringen på, at ministeren endnu ikke har kunnet svare på spørgsmålene? ",0,91,910847,4,18,3,,2011,,,2016,3/18/2016
185017,2015,13,1304,"Er ministeren enig i, at det er stærkt uheldigt, at den manglende enighed om rimelighedskravet forhindrer, at socialøkonomiske virksomheder som f.eks. Rosenbedet i Brande kan ansætte flere førtidspensionister i skånejob, og at de snart bliver nødt til at opsige dem, der allerede er ansat?",0,91,910843,4,18,3,,1304,,,2016,3/18/2016
185037,2015,14,1403,"Hvordan ser ministeren på analysen fra Region Hovedstaden, som viser, at trængselsproblemet i Storkøbenhavn om 10 år vil være dobbelt så stort som i dag og koste samfundet 4 mia. kr. om året i tabt produktivitet, og hvordan forholder ministeren sig til rapportens anbefalinger?

",0,91,910863,18,22,3,,1403,,,2016,3/22/2016
185031,2015,13,1300,"Hvordan forholder ministeren sig til det, som fremgår af DR's artikler den 11. marts 2016 med overskrifterne »Ældresagen: Chokerende og uværdig behandling af ældre« og »Efter ti år med hjemmehjælper: Nu er Bodil for frisk til at få hjælp«, og finder ministeren det stemmende med princippet om, at hjælp skal ydes efter en konkret og individuel vurdering af behovet, hvis kommuner sænker serviceniveauet for hjemmehjælp, så kun f.eks. demente, blinde og lamme kan få hjælp?",0,91,910857,14,22,3,,1300,,,2016,3/22/2016
185033,2015,12,1201,"Hvordan forholder ministeren sig til de problemstillinger, der er beskrevet i artiklen »Sheriffen skyder med løst krudt: Betjente fjernes fra nattelivet« fra Ekstra Bladet den 15. marts 2016, hvor det på baggrund af et brev fra en tillidsmand til politidirektøren i København beskrives, at patruljer til at håndhæve den nye knivlov »bliver skåret ind til en nærmest ikkeeksisterende størrelse«?",0,91,910859,6,22,3,,1201,,,2016,3/22/2016
185036,2015,20,2007,,0,91,910862,3,22,3,,2007,,,2016,3/22/2016
185034,2015,12,1201,,0,91,910860,6,22,3,,1201,,,2016,3/22/2016
185035,2015,8,800,,0,91,910861,19,22,3,,800,,,2016,3/22/2016
185052,2015,6,607,,0,91,910878,21,31,3,,607,,,2016,3/31/2016
185051,2015,6,607,"Er ministeren enig med Dansk Folkepartis kulturordfører i, at danskernes adgang til at låne e-bøger skal begrænses og privatiseres som foreslået i Altinget den 15. marts?",0,91,910877,21,31,3,,607,,,2016,3/31/2016
185066,2015,20,2004,Hvilke overvejelser gør ministeren sig i anledning af drabet på den 57-årige social- og sundhedsassistent på bostedet Lindegården i Roskilde begået den 25. marts 2016 af en 30-årig psykisk syg og misbrugende beboer?,0,91,910892,7,1,4,,2004,,,2016,4/1/2016
185061,2015,12,1201,"Når det fremgår af svaret på spørgsmål nr. 347 (alm. del) fra Folketingets Retsudvalg, at der ikke i nogen af landets politikredse er boligområder, hvor politiet generelt set ikke kan passe deres arbejde på normal vis uden at tage særlige forholdsregler, men formanden for Politiforbundet, Claus Oxfelt, den 17. februar 2016 på TV 2 udtaler, at områder som Gellerup i Aarhus Vest, Vollsmose i Odense og dele af Nørrebro i København er steder, hvor det kan være svært at patruljere for politiet, giver det så ikke ministeren anledning til bekymring?",0,91,910887,6,1,4,,1201,,,2016,4/1/2016
185056,2015,12,1201,"Vil ministeren se på, om man kan fordele politiressourcerne mere fair, så Nordjylland ikke fremover skal være så hårdt belastet af mangel på politi, som tilfældet er i øjeblikket?",0,91,910882,6,1,4,,1201,,,2016,4/1/2016
185058,2015,9,900,"Hvad er ministerens holdning til, at der bliver sendt færre kriminelle udlændinge hjem til afsoning trods løfter om det modsatte før valget?",0,91,910884,6,1,4,,900,,,2016,4/1/2016
185063,2015,13,1308,,0,91,910889,4,1,4,,1308,,,2016,4/1/2016
185069,2015,4,400,"Hvorfor mente statsministeren, at det var nødvendigt at mødes med embedsmænd fra Miljø- og Fødevareministeriet om fødevare- og landbrugspakken?",0,91,910895,1,1,4,,400,,,2016,4/1/2016
185064,2015,19,1929,"Hvad mener ministeren om, at man som tyvebande fra Østeuropa ubesværet kan komme ind i Danmark grundet aftalerne i EU, men at man ikke risikerer at blive opdaget med varebilen fuld af tyvkoster ved udkørsel af Danmark, da grænsekontrollen ikke er etableret for dem, der forlader landet, og har ministeren til hensigt at ændre dette?",1,91,910890,32,1,4,,1929,,,2016,4/1/2016
185067,2015,4,400,"Hvorfor mente ministeren, at det var nødvendigt at mødes med embedsmænd fra Miljø- og Fødevareministeriet om fødevare- og landbrugspakken?",0,91,910893,12,1,4,,400,,,2016,4/1/2016
185057,2015,20,2004,"Hvilke overvejelser gør ministeren sig i anledning af de mange historier i pressen om, at såvel omsorgs- og myndighedspersoner som f.eks. plejepersonale, politi og brandvæsen ikke kan passe deres arbejde i belastede boligområder uden at tage særlige forholdsregler, og hvilke initiativer vil ministeren tage for at sikre, at såvel omsorgs- som myndighedspersoner kan passe deres arbejde i belastede boligkvarterer uden at skulle frygte for at blive overfaldet og chikaneret?",0,91,910883,6,1,4,,2004,,,2016,4/1/2016
185065,2015,13,1304,"Hvad er ministerens holdning til, at kommunerne i stigende omfang kræver en diagnose, for at borgere med tab af funktionsevne kan opnå ret til sociale ydelser, som det f.eks. er beskrevet i artiklen »Sundhedsdirektør: Kommunerne kræver alt for ofte en diagnose for at hjælpe« i Politiken den 26. marts 2016?",0,91,910891,7,1,4,,1304,,,2016,4/1/2016
185059,2015,9,900,"Hvad agter ministeren at gøre for at sikre, at dømte og udviste kriminelle udlændinge rent faktisk bliver sendt ud af landet efter hensigten i loven?",0,91,910885,6,1,4,,900,,,2016,4/1/2016
185060,2015,4,498,"Hvad agter ministeren at gøre for at styrke udviklingen af flere forsknings- og uddannelsespladser på Lolland-Falster, som kan understøtte de stærke kompetencer, f.eks. inden for landbrugsproduktion, som området i forvejen er i besiddelse af?",0,91,910886,28,1,4,,498,,,2016,4/1/2016
185074,2015,9,900,,0,91,910900,32,4,4,,900,,,2016,4/4/2016
185075,2015,19,1929,,1,91,910901,32,4,4,,1929,,,2016,4/4/2016
185090,2015,9,900,"Påtænker ministeren at tage politiske skridt for at sikre, at forskellige kommuner ikke giver dispensationer til tvivlsomme moskeer, i modstrid med ministerens holdninger om at jævne moskeer som Grimhøj med jorden, hvis det altså var muligt i forhold til grundloven?",0,91,910916,32,7,4,,900,,,2016,4/7/2016
185091,2015,10,1002,"Hvad er ministerens holdning til, at borgere, der bl.a. af Lolland Kommune har fået betalt undervisningen til et erhvervskørekort, risikerer at skulle starte undervisningen forfra, fordi sagsbehandlingen ved Administrativt Center Øst i forbindelse med udstedelse af kørekortet er så lang, at undervisningen bliver forældet, inden borgerne får deres erhvervskørekort?",0,91,910917,6,7,4,,1002,,,2016,4/7/2016
185097,2015,21,2101,"Hvad er ministerens holdning til at gøre arbejdet med bygningsbevaring af vore historiske bymiljøer til en del af ministerens planer om en danmarkskanon, og hvordan kunne ministeren sætte det i værk?",0,91,910923,21,7,4,,2101,,,2016,4/7/2016
185092,2015,17,1798,"Vil ministeren overveje at ændre praksis om, at universitetsforskere skal tilbageholde tal inden offentliggørelse af politiske forlig, så vi kan få de bedste rammer for en gennemsigtig og oplyst politisk debat?",0,91,910918,9,7,4,,1798,,,2016,4/7/2016
185095,2015,3,331,"Hvad er ministerens holdning til, at mennesker med muskelsvind ikke får optimal behandling, når de indlægges på lokalsygehuse?",0,91,910921,14,7,4,,337,,,2016,4/7/2016
185089,2015,9,900,"Hvad er ministerens holdning til, at Det Islamiske Trossamfund i København, som var en af de otte moskeer, som blev portrætteret i TV 2's »Moskeerne bag sløret«, efterfølgende har fået tilladelse til en ændring af lokalplanen, af bl.a. ministerens eget parti, til at opføre en ny og større moské?",0,91,910915,32,7,4,,900,,,2016,4/7/2016
185098,2015,12,1201,,0,91,910924,6,7,4,,1201,,,2016,4/7/2016
185088,2015,12,1201,"Hvordan påtænker ministeren at undgå, at et i forvejen meget presset dansk politi bliver endnu mere presset, i så fald at forårets komme medfører et nyt stort antal migranter, som vi så det i efteråret 2015?",0,91,910914,6,7,4,,1201,,,2016,4/7/2016
185099,2015,6,602,"Hvad er ministerens holdning til, at regeringens udspil til en ny gymnasiereform ser ud til at få den konsekvens, at 8,4 pct. af de studerende i Nordjylland ikke vil kunne komme ind på gymnasierne, fordi de ikke opfylder kravet om karakteren 4 i dansk og matematik?",0,91,910925,15,7,4,,602,,,2016,4/7/2016
185087,2015,12,1201,,0,91,910913,6,7,4,,1201,,,2016,4/7/2016
185113,2015,6,602,"Hvad er ministerens holdning til følgende udtalelse fra hf-uddannelseslederen på Campus Bornholm om regeringens udspil til ny gymnasiereform: »Først og fremmest så tænker vi, at det er lidt bekymrende med det firetal, for det vil forhindre en masse unge i at få en ungdomsuddannelse, som kan bringe dem videre, og det er ligesom dem nede i bunden, som vi er bekymrede for på den måde. Og så er vi også rigtig ærgerlige over, at de unge ikke kan få direkte adgang til universiteterne, for femten procent af vores elever vælger faktisk at gå den vej«?",0,91,910939,15,8,4,,602,,,2016,4/8/2016
185122,2015,4,408,,0,91,910948,9,8,4,,408,,,2016,4/8/2016
185121,2015,4,408,"Mener ministeren, at det er problematisk, som det fremgår af en artikel fra TV 2 NEWS den 5. april 2016 med overskriften »Højesteretsdom: Fiskeriforbud var ikke i strid med EU-retten«, at så mange fiskere i Nordsjælland må oplægge deres skibe, fordi de ikke må fiske i områder af Kattegat?",1,91,910947,9,8,4,,408,,,2016,4/8/2016
185110,2015,6,604,,0,91,910936,15,8,4,,604,,,2016,4/8/2016
185106,2015,19,1929,,1,91,910932,2,8,4,,1929,,,2016,4/8/2016
185104,2015,17,1707,,0,91,910930,21,8,4,,1707,,,2016,4/8/2016
185105,2015,19,1929,"Finder udenrigsministeren, at Australiens premierminister har ret i sin udtalelse om, at Europa har sløset med sikkerheden ved at fæste al sin lid til Schengen?",1,91,910931,2,8,4,,1929,,,2016,4/8/2016
185112,2015,12,1201,"Er det ministerens opfattelse, at antallet af uniformerede politifolk er øget som følge af politireformen i 2007?",0,91,910938,6,8,4,,1201,,,2016,4/8/2016
185107,2015,19,1910,"Finder ministeren det nødvendigt, set i forhold til Australiens premierministers udtalelser og næstformanden for EU-kommissionen Frans Timmermans udtalelser: »Krisen har blotlagt klare svagheder og huller i de eksisterende mekanismer til at sikre overholdelsen af EU's standarder« at give øgede beføjelser til nationalstaten?",1,91,910933,2,8,4,,1910,,,2016,4/8/2016
185114,2015,5,501,,0,91,910940,6,8,4,,501,,,2016,4/8/2016
185101,2015,9,900,"Finder ministeren det rimeligt, at en organisation som Hizb ut-Tahrir lovligt kan operere i Danmark med den dagsorden, de arbejder efter, og har ministeren til hensigt at kræve organisationen forbudt, eventuelt med en lovændring?",0,91,910927,6,8,4,,900,,,2016,4/8/2016
185117,2015,4,400,"Hvorfor mener statsministeren, at det var relevant at deltage i møder med embedsmænd fra Miljø- og Fødevareministeriet om fødevare- og landbrugspakken?",0,91,910943,1,8,4,,400,,,2016,4/8/2016
185128,2015,9,900,"Finder ministeren, at det er en fornuftig udvikling, at den danske kultur bliver tilsidesat grundet et hensyn til en muslimsk minoritetskultur, som formentlig kun udgør omkring 5 pct. af befolkningen?",0,91,910954,32,12,4,,900,,,2016,4/12/2016
185127,2015,9,900,,0,91,910953,32,12,4,,900,,,2016,4/12/2016
185134,2015,19,1929,,1,91,910960,32,14,4,,1929,,,2016,4/14/2016
185140,2015,12,1201,"Kan man forestille sig, at mere nuancerede kriterier såsom nærhed til andre uddannelsesinstitutioner, der uddanner til beslægtede funktioner, afstand til lufthavn og transporttid herfra, tilstedeværelse af faciliteter til uddannelse inden for brand, nærkamp, røgdykning og politihundetræning og veludbygget kapacitet med hensyn til ungdomsboliger, vil kunne lægges til grund for valg af placering af den vestlige politiskole i Danmark? ",0,91,910966,6,14,4,,1201,,,2016,4/14/2016
185147,2015,6,601,"Hvilke tanker gør ministeren sig om, hvordan uddannelse og forskning kan bidrage til at ændre på den lave vækst i Danmark?",0,91,910973,28,14,4,,601,,,2016,4/14/2016
185138,2015,12,1201,,0,91,910964,6,14,4,,1201,,,2016,4/14/2016
185135,2015,19,1929,"Påtænker ministeren at indføre en permanent grænsekontrol for at kunne effektuere statsministerens udmelding om at stoppe hadprædikanter, som et internt regeringsnotat peger på som en forudsætning, oplyst på dr.dk den 3. april 2016 under rubrikken »Løkkes værn mod hadprædikanter truet af EU-regler«?",1,91,910961,32,14,4,,1929,,,2016,4/14/2016
185136,2015,12,1201,,0,91,910962,6,14,4,,1201,,,2016,4/14/2016
185148,2015,6,600,"Hvordan vil ministeren fremadrettet prioritere uddannelse og forskning set i et vækstperspektiv for danske virksomheder, efter at regeringen i sit første år har valgt at skære 10 mia. kr. på netop disse områder frem til 2019?",0,91,910974,28,14,4,,600,,,2016,4/14/2016
185149,2015,6,601,,0,91,910975,28,15,4,,601,,,2016,4/15/2016
185150,2015,6,604,"Vil ministeren tage initiativ til, at pædagogstuderende med kroniske lidelser igen kan få mulighed for at tage kortere praktikforløb som en del af uddannelsen, så disse unge også har en mulighed for at tage en uddannelse?",0,91,910976,28,15,4,,604,,,2016,4/15/2016
185155,2015,5,599,"Hvilke konkrete tiltag, som ikke allerede eksisterer, vil ministeren sætte i gang for at afhjælpe ingeniørmanglen i Kalundborgs industrisymbiose?",0,91,910981,28,15,4,,508,,,2016,4/15/2016
185151,2015,6,601,,0,91,910977,28,15,4,,601,,,2016,4/15/2016
185160,2015,12,1201,"Finder ministeren det bekymrende, at der er mangel på lokalt politi i Hirtshals, når nu Hirtshals Havn er et trafikalt knudepunkt, når man har hørt eksempler på flygtninge, som har skjult sig på færgen til Norge, og når Hjørrings borgmester frygter for sikkerheden på havnen?",0,91,910986,6,15,4,,1201,,,2016,4/15/2016
185154,2015,6,601,"Hvordan vil ministeren imødekomme det anerkendte behov for en ingeniøruddannelse i Kalundborgs industrisymbiose, når ministeren kræver et etableret ingeniørfagligt miljø, men ingen af de universiteter, der har en etableret ingeniøruddannelse, ønsker at etablere en uddannelse i Kalundborg?",0,91,910980,28,15,4,,601,,,2016,4/15/2016
185159,2015,14,1408,"Under Beskæftigelsesudvalgets samråd med ministeren onsdag den 13. april indikerede ministeren, at det var hensigten, at lovgivning om pensionisters boligydelse kunne fremsættes inden sommer som en udmøntning af aftalen mellem regeringen, Dansk Folkeparti, Liberal Alliance og Det Konservative Folkeparti af 15. december 2015, og er det i den forbindelse også finansministerens hensigt, at der skal fremsættes lovgivning om aftalens øvrige elementer inden sommeren 2016, herunder en ændring af udligningsskatten på pensioner frem mod 2020?",0,91,910985,3,15,4,,1408,,,2016,4/15/2016
185158,2015,2,202,"Finder ministeren, at det er i overensstemmelse med danske værdier, at uddannelsesinstitutionen CBS tillader, at Islamic Academic Association afholder kønsopdelte møder i institutionens lokaler, som det beskrives i artiklen »Kønsopdelt koran-undervisning på dansk universitet skaber debat« fra tv2.dk den 15. april 2016?",0,91,910984,28,15,4,,202,,,2016,4/15/2016
185152,2015,6,602,"Hvordan vil regeringen sikre kvaliteten i undervisningen og den fortsatte rekruttering af lærere til folkeskolen, hvis andelen af lærerenes undervisningstid stiger og stiger?",0,91,910978,15,15,4,,602,,,2016,4/15/2016
185163,2015,1,107,,0,91,910989,23,15,4,,107,,,2016,4/15/2016
185164,2015,6,606,,0,91,910990,15,15,4,,606,,,2016,4/15/2016
185157,2015,8,800,,0,91,910983,19,15,4,,800,,,2016,4/15/2016
185162,2015,15,1525,,0,91,910988,18,15,4,,1525,,,2016,4/15/2016
185161,2015,1,107,,0,91,910987,23,15,4,,107,,,2016,4/15/2016
185193,2015,5,501,"Hvad er ministerens holdning til, at man på en offentligt finansieret arbejdsplads som BIOS går så meget på kompromis med arbejdsmiljøet og udsætter medarbejdere i beredskabet for 17 dobbeltvagter på en måned – herunder dobbeltvagter 4 dage i træk – med fare for stress og overbelastning?",0,91,911019,4,20,4,,501,,,2016,4/20/2016
